{
  "$schema": "https://puretokensx.com/schemas/model-profile.schema.json",
  "schemaVersion": 1,
  "capability": "image",
  "catalogUpdatedAt": "2026-10-04",
  "catalogCapturedAt": "2026-10-04T06:19:22.134Z",
  "id": "grok-imagine-image-2.0",
  "parameterSchema": {
    "properties": {
      "n": {
        "type": "integer",
        "enum": [
          1
        ],
        "default": 1
      },
      "size": {
        "type": "string"
      },
      "image": {
        "type": "json"
      }
    },
    "constraints": {
      "response_format": {
        "value": [
          "url"
        ]
      },
      "reference_transport": {
        "image": [
          "public_https_url",
          "max_1"
        ]
      }
    },
    "operations": {
      "image_edit": {
        "request": {
          "method": "POST",
          "path": "/v1/images/edits",
          "contentType": "multipart/form-data"
        },
        "requiredBodyFields": [
          "model",
          "prompt",
          "image"
        ],
        "inputs": {
          "image": {
            "field": "image",
            "required": true,
            "minItems": 1,
            "maxItems": 1,
            "transports": [
              "multipart_file"
            ]
          }
        }
      }
    }
  }
}
