{
  "$schema": "https://puretokensx.com/schemas/model-profile.schema.json",
  "schemaVersion": 1,
  "capability": "video",
  "catalogUpdatedAt": "2026-09-16",
  "catalogCapturedAt": "2026-09-16T04:21:35.466Z",
  "id": "grok-video-1.5",
  "parameterSchema": {
    "properties": {
      "image": {
        "type": "json"
      },
      "duration": {
        "type": "integer",
        "min": 1
      },
      "resolution": {
        "type": "string",
        "enum": [
          "480p",
          "720p"
        ]
      },
      "aspect_ratio": {
        "type": "string",
        "enum": [
          "1:1",
          "16:9",
          "9:16",
          "4:3",
          "3:4",
          "3:2",
          "2:3"
        ]
      }
    },
    "constraints": {
      "resolution_by_mode": {
        "text": [
          "480p",
          "720p"
        ],
        "image": [
          "480p",
          "720p"
        ],
        "reference": [
          "480p",
          "720p"
        ]
      },
      "reference_transport": {
        "image": [
          "public_https_url",
          "max_1"
        ]
      }
    },
    "operations": {
      "video_edit": {
        "request": {
          "method": "POST",
          "path": "/v1/videos/edits",
          "contentType": "multipart/form-data"
        },
        "requiredBodyFields": [
          "model",
          "prompt",
          "video"
        ],
        "inputs": {
          "video": {
            "field": "video",
            "required": true,
            "minItems": 1,
            "maxItems": 1,
            "transports": [
              "multipart_file"
            ]
          }
        }
      },
      "image_to_video": {
        "request": {
          "method": "POST",
          "path": "/v1/videos",
          "contentType": "multipart/form-data"
        },
        "requiredBodyFields": [
          "model",
          "prompt",
          "image"
        ],
        "inputs": {
          "image": {
            "field": "image",
            "required": true,
            "minItems": 1,
            "maxItems": 1,
            "transports": [
              "multipart_file"
            ]
          }
        }
      },
      "reference_image_video": {
        "request": {
          "method": "POST",
          "path": "/v1/videos",
          "contentType": "multipart/form-data"
        },
        "requiredBodyFields": [
          "model",
          "prompt",
          "reference_images"
        ],
        "inputs": {
          "reference_images": {
            "field": "reference_images",
            "required": true,
            "minItems": 1,
            "maxItems": 1,
            "transports": [
              "multipart_file"
            ]
          }
        }
      }
    }
  }
}
